"question","answers"
"Phân biệt đối xử thường được kết hợp với là gì?","tư duy phân biệt chủng tộc"
"Tito đã sử dụng cái gì để đưa mọi người đến đơn vị trong trận chiến chống lại sự chiếm đóng năm 1941?","tờ rơi"
"Các đảng chính trị được bầu trong các nền dân chủ như thế nào?","cử tri"
"Shelby Steele tin rằng khái niệm thực sự của hành động khẳng định là gì?","thực thi cơ hội bình đẳng"
"Một yếu tố của Carnival Peru không được tìm thấy trong bất kỳ lễ kỷ niệm của đất nước khác là gì?","tấn công tình dục phụ nữ"
"Tám bệnh được kiểm tra là gì?","tỷ lệ tử vong"
"Có bao nhiêu thành phần quân đội bị ảnh hưởng bởi Chính sách tổng lực?","ba"
"Vào năm nào, người Anh đã lấy Swaziland làm người bảo hộ?","1903"
"Bản đồ Madaba được tái phát hiện khi nào?","1894"
"Nhà vua đã phủ quyết Dự luật sửa đổi vũ khí và đạn dược vào tháng mấy?","tháng 12"
"Ước tính cao nhất về dân số Ba Lan của thành phố Southampton là gì?","20"
"Bệnh viện tâm thần duy nhất ở Montevideo là gì?","Bệnh viện Vilardebó"
"Theo nguyên tắc nào hầu hết các luật ở Thái Lan quyết định?","royalist"
"Những bộ phận khác có một bộ đồng phục?","găng tay, kiếm và huy chương"
"Đâu là hầu hết các thông tin về Freestyle bị bức hại trong Holocaust nằm ở đâu?","Các hồ sơ được lưu giữ của Reichss Richheitshauptamt (Văn phòng chính An ninh Reich)"
"Điều gì đã xảy ra với dân số vào năm 1880?","đã tăng gấp bốn lần"
"Vùng đất nào được bao gồm trong vương quốc Shu?","Thành Đô ngày nay, vùng đồng bằng và các vùng lãnh thổ lân cận ở phía tây Tứ Xuyên"
"Julius Caesar trở về Rome khi nào?","61 trước Công nguyên"
"Một mạch chuyển đổi đang cố gắng mô phỏng khi bật là gì?","ngắn mạch"
"Từ đó mọi người đã được nhiều khía cạnh của văn hoá La Mã sao chép từ đâu?","Hy Lạp"
"Điều gì đã được thảo luận kể từ khi Cộng hoà Liên bang được thành lập vào năm 1949?","phân định mới lãnh thổ liên bang"
"Năm 1836, ai đã phát minh ra khẩu súng lục ổ quay tự động trong nhà máy sản xuất súng của Eli Whitney?","Samuel Colt"
"Điều gì được coi là trái với niềm tin duy tâm liên quan đến không gian?","các đối tượng tồn tại độc lập với tâm trí"
"Harper Lee qua đời khi nào?","tháng 2 năm 2016"
"Điều gì được đặt ra là nguyên nhân của sản lượng nghệ thuật tăng lên trong thời Phục hưng?","sự sung sướng lớn hơn"
"Điều gì nên được dự đoán vì nhiều yếu tố ảnh hưởng đến mật độ của gỗ?","Biến thể"
"Khi nào Arsenal gia nhập Liên đoàn bóng đá?","1893"
"Một thuật ngữ cho các bệnh hiếm gặp ở một số vùng lãnh thổ là gì?","bệnh mồ côi"
"Có khó khăn để chuyển bản ghi từ lợi ích lịch sử sang các công nghệ mới hơn không?","Bất cứ ai cũng có thể làm điều này"
"Mục tiêu của thử nghiệm đơn vị là gì?","đạt được tích hợp liên tục trong đó các bản cập nhật phần mềm có thể được xuất bản ra công chúng thường xuyên"
"Các dải hấp thụ khí mêtan trên sao Hải Vương ở đâu?","trên 600nm"
"Khi nào các quy định của Liên đoàn khiến Arsenal giảm chỗ ngồi ở Highbury?","1993 mùa94"
"Sự nhượng bộ Gored được thực hiện với vụ đánh bom chiến lược chống lại Anh là gì?","Chỉ thị 23"
"Popper đã viết cho Hayek một lá thư thể hiện món nợ trí tuệ của mình vào năm nào?","1944"
"Hai phương ngữ đã bị cấm từ cuộc sống công cộng?","Alsatian và tiếng Đức tiêu chuẩn"
"Công ty nào đã trình diễn bất hợp pháp một trò chơi Nintendo?","Coleco"
"Ngoài radar và điện toán, phòng không còn muốn khai thác điều gì nữa?","tên lửa dẫn đường"
"Công ty nào đã tạo ra U-2?","Lockheed"
"Có bao nhiêu nhóm người săn bắn hái lượm hiện đại?","Chỉ có một vài"
"Phong trào nào mà nhóm Lizards mắc nợ?","không có sóng"
"Đâu là những cảnh có máy bay được quay?","Palenque"
"Vấn đề của Trung Đông được công bố bởi ai?","Thomas Edward Gordon"
"Ai tuyên bố rằng việc nuôi dạy học sinh dân tộc thiểu số một cách giả tạo có ảnh hưởng tiêu cực đến họ?","Richard Sander"
"Hai dân tộc nào chiếm đa số trong Quân đội Banner?","Manchu và Mongol"
"Cùng với Hoa Kỳ, Vương quốc Anh và Pháp, ai đã thành lập SEATO?","New Zealand và Úc"
"Một ngôi đền mới dành riêng cho Núi Alban là của ai?","Jupiter Latiaris"
"Đâu là nơi mà chất thải rắn của Hyderabad được đổ?","Jawaharnagar"
"Cuộc tấn công đã xảy ra ở đâu?","giải tán dữ dội trước sân vận động Druzhba"
"Trang web nào đã chạy một cuộc khảo sát để tìm hiểu tần suất iPod ngừng hoạt động?","MacInTouch"
"Nhóm ngôn ngữ Đức nào bao gồm tiếng Hà Lan, tiếng Anh và tiếng Đức?","Tây Germanic"
"Thời kỳ nào theo triều đại nhà Hán?","Tam quốc"
"Bài hát nào khác từ nhạc phim đã làm tốt hơn trong các bảng xếp hạng?","Summertime"
"Đến thời điểm nào Hội đồng yêu cầu ngày của Equinox vernal được thiết lập?","325"
"Ai tự giới thiệu mình là người mẫu?","Phật Gautama"
"Ai là người đầu tiên đưa ra ý tưởng cho một hệ thống định vị vệ tinh Trung Quốc?","Chen Fangyun và các đồng nghiệp"
"Khác với Call of Duty 2, có bao nhiêu game bán được ít nhất 1 triệu bản trong năm đầu tiên của 360?","Năm"
"Quốc gia nào sở hữu phía tây New Guinea?","nes, Hà Lan"
"Ai đã hỏi ý kiến ​​một phù thuỷ trước trận chiến Pharsalus?","Sextus Pompeius"
"Có gì mới về cách thu âm của Western Electrics?",""
"Nhà Minh đã ban tặng những danh hiệu nào cho các Lạt ma của trường học?","Karmapa Kargyu"
"Điều gì không được coi là ảnh hưởng của ảnh hưởng của Rome ở phía tây?","xây dựng đế chế có chủ ý"
"Tiêu đề của ca khúc được thêm vào trong Love Song là gì?","Nucle"
"Bao nhiêu thu nhập được tạo ra từ các khoản tài trợ và hợp đồng nghiên cứu cho năm 2013?","£ 330,5 triệu"
"Có bao nhiêu phiếu bầu văn bản đã có trong phần tám của American Idol qua phần bảy?","100 triệu"
"Tây Nam Cực giống gì nhất về mặt địa chất?","dãy núi Andes của Nam Mỹ"
"Những Sắc lệnh hành pháp nào khác mà Đạo luật Dân quyền phối hợp chặt chẽ với?","11114"
"Khi nào các vấn đề của trái đất và di truyền được giải quyết?","trong thế kỷ 20"
"Cảnh sát thường được trả như thế nào?","thông qua thuế"
"Khi nào thảm được biết đến sớm nhất từ ​​Armenia?","đầu thế kỷ 13"
"Sự kiện lớn nào mà Beyoncé đã biểu diễn vào ngày 1 tháng 2 năm 2004?","Super Bowl XXXVIII"
"Khẩu hiệu nào thường được sử dụng trong các cuộc biểu tình của người Thổ Nhĩ Kỳ?","""Phân vùng hoặc cái chết"""
"Năm nào nhà Minh cắt đứt hệ thống cấp bậc của Karmapa?","1446"
"Tu viện đã xây dựng gì ở phía tây?","cửa hàng và nhà ở"
"Bao nhiêu lần Hay thường được mang mỗi năm?","hai lần"
"Muawiyah đã tìm thấy gì ở Bắc Phi?","Kairouan"
"Ví dụ đầu tiên của hình học liên tục là gì?","dự đoán của yếu tố loại II siêu phẳng"
"Lợi ích của việc lắp đặt kính với mặt dày ở phía dưới, ngoài việc tránh tích nước?","ổn định"
"Tổng thống Mỹ nào đã ký Hiến chương Đại Tây Dương?","Roosevelt"
"Trái ngược với các quận khác, giao thông công cộng, kiểm soát giao thông, kiểm soát và giáo dục là trách nhiệm của chính quyền địa phương hay chính quyền bang?","chính phủ tiểu bang Victoria"
"Saraiki thường nói ở đâu?","nam Punjab"
"Trường hợp di cư chủ yếu xảy ra ở đâu?","bắc bán cầu"
"Những con đường bị hư hại gây ra cho các hoạt động cứu hộ là gì?","sự chậm trễ đến"
"Có bao nhiêu ban nhạc đã hoạt động trong khu vực Liverpool trong những năm 1960?","350"
"Thuật ngữ đóng có nghĩa là gì?","Những người có khuynh hướng tình dục đồng giới không phù hợp với bản sắc tình dục của họ"
"Doanh số bán hàng âm nhạc kỹ thuật số và vật lý giống nhau vào năm nào?","2014"
"Trong lĩnh vực kinh tế phụ là những cảm xúc được thảo luận?","kinh tế vi mô"
"Sự hy sinh nghiêm trọng trong thời của Cicero là gì?","gieo"
"Người Sumer có thể mong đợi kiểu gì về thế giới bên kia?","giam cầm trong một thế giới ảm đạm"
"Phạm vi của nhiệt độ trung bình trong lưu vực Tứ Xuyên là gì?","0 đến 15 ° C"
"Tại sao một số nhà khoa học không chắc chắn về hồ sơ hoá thạch?","hồ sơ hoá thạch bị sai lệch mạnh mẽ như thế nào bởi tính sẵn có và bảo tồn lớn hơn của các phần địa chất gần đây."
"Trận chiến Bulge bắt đầu khi nào?","tháng 12 năm 1944"
"Spielberg có bao nhiêu mũi đẫm máu ở trường trung học?","Hai"
"Điều gì là phong phú hơn trong các dự án vốn?","hối lộ và đá lại"
"Vương cung thánh đường của các vị vua Hungary còn được gọi là gì?","Alba Regia"
"Ai chịu trách nhiệm bầu và bãi nhiệm Lãnh tụ tối cao?","Hội các chuyên gia"
"Khi nào kiểm soát được quay trở lại kiểm soát mặt đất?","Sau khi máy bay hạ cánh"
"Định dạng ban đầu cho các tệp âm thanh đã mua trên iTunes là gì?","AAC"
"Có bao nhiêu quân đội và y tế Trung Quốc đã tham gia vào các nỗ lực cứu trợ?","135"
"Ai đã mất quyền lực của họ trên Tây Tạng?","Phagmodrupa"
"Đảo Norfolk thuộc địa của ai?","Đông Polynesia"
"Một ví dụ về một ứng dụng tốt cho bóng đèn có tuổi thọ cao là gì?","khó tiếp cận (ví dụ: đèn giao thông hoặc đồ đạc treo trên trần nhà cao)"
"Ai là nhà sản xuất điều hành của American Idols mùa thứ mười?","Nigel Lythgoe"
"Mức độ tham nhũng có thể khác nhau ở các nền dân chủ giàu có hơn liên quan đến những gì các quan chức đưa ra quyết định?","trách nhiệm"
"Nỗ lực thống nhất tiếng Latin, tiếng Hy Lạp và Cyrillic sẽ tạo ra loại vấn đề nào?","làm cho các hoạt động vỏ bọc trở thành một mớ hỗn độn"
"Tiếng Anh cổ được sử dụng trong bao nhiêu năm?","700"
"Trường hợp mọi người không hỏi về nền tảng chủng tộc?","khu vực biên giới"
"Khi nào môi trường làm việc an toàn được áp dụng cho lao động trẻ em?","1989"
"Judith Rodin trở thành nữ chủ tịch đầu tiên của trường Ivy League vào năm nào?","1994"
"Chim cần thay đổi gì để đáp ứng nhu cầu di cư?","sự trao đổi chất của chúng"
"Tại sao thất bại Daun của Frederick lại tốn kém như vậy?","anh ta đã chịu tổn thất rất nặng nề và người Áo đã rút lui theo trật tự tốt."
"Lệnh điều hành nào đầu tiên có cụm từ ""hành động khẳng định""?","Sắc lệnh 10925"
"American Idol ra mắt khi nào?","tháng 6 năm 2002"
"Có phải thanh thiếu niên hoặc người lớn dường như tăng thêm trọng lượng cho phần thưởng?","thanh thiếu niên"
"Thuật ngữ nào Whitehead mô tả rằng nhận thức không giới hạn trong cuộc sống?","prehension"
"Hội đồng Cách mạng Tối cao đã đặt tên gì cho Somalia?","Cộng hoà Dân chủ Somalia"
"Một ví dụ về một vấn đề được nêu ra trong đánh giá tài sản thế chấp là gì?","hỗ trợ tư vấn không hiệu quả"
"Những loại áo giáp mới thay thế cũ?","áo giáp"
"Vào năm nào, Gonzalez nhận được sự đổi mới?","1837"
"Đội WNBA của Oklahoma là gì?","Tulsa Shock"
"Vào tháng 1 năm 2010, Mark Zandi đã làm chứng những thị trường nào về tình trạng vẫn còn suy yếu và các nhà đầu tư dự đoán sẽ có nhiều khoản cho vay hơn?","thị trường chứng khoán hoá"
"Ở tuổi nào Frédéric bắt đầu tổ chức các buổi hoà nhạc công cộng?","7"
"Đối số Mach được gọi là gì?","Nguyên tắc Mach"
"Hai phương pháp ánh xạ mà Unicode định nghĩa là gì?","Định dạng chuyển đổi Unicode (UTF) và mã hoá Bộ ký tự mã hoá phổ quát (UCS)"
"Ai đã xin Paul VI cho phép hợp tác với người Tin lành để dịch kinh thánh?","Đức Hồng Y Augustin Bea"
"Cuộc chiến năm 1812 bao gồm Hoa Kỳ chống lại ai?","Vương quốc Anh"
"Số quận của Estonia có trên 80% dân tộc Estonia là bao nhiêu?","Mười ba"
"Khu vực này có kinh nghiệm gì?","hạn hán"
"Thành phần chính của mỗi protein là gì?","axit amin"
"Weinreich đưa ra khái niệm tâm lý nào giữa quá khứ và tương lai?",""
"Những gì đã có Rutherford trước khi được bầu làm chủ tịch của nhóm?","đại diện pháp lý"
"Nam Cực có loại khí hậu nào trong thời kỳ kỷ Phấn trắng?","cận nhiệt đới"
"Ai là người sáng lập vương triều Kirata?","Yalamber"
"Làm thế nào mà người Anh tránh được việc có một đội quân lớn ở lục địa châu Âu?","liên minh với một hoặc nhiều cường quốc lục địa mà lợi ích của họ là phản đối với kẻ thù của họ,"
"Có bao nhiêu giải vô địch đã giành được giải đấu thể thao kể từ năm 2001?","chín"
"Nếu họ không hoàn toàn là những người săn bắn hái lượm, vậy thì họ có lịch sử tồn tại là gì?","nhà nông nghiệp"
"Cùng với The Star và The Sun, biểu tượng điển hình được sử dụng trên bảng hiệu quán rượu là gì?","Thánh giá"
"Mô hình của La Maison Cubiste lớn như thế nào?","10 x 3"
"Khi nào tỉnh tự trị Karachay kết thúc?","1943"
"Ai ủng hộ Beg?","Anh"
"Số lượng bộ trưởng nhất mà một Thủ tướng có thể giao là bao nhiêu?","ba"
"Các thành viên Nghị viện đã hét lên khi chuyển tiếp thông qua?","Tự do cho Tây Tạng!"
"Ngành nào được nhắm đến","Khoa học y tế / sinh học"
"Detroit đã có bao nhiêu vụ giết người trong năm 2015?","295"
"Ai là người lãnh đạo lao động của Teamsters?","Jimmy Hoffa"
"MPAA đã ủng hộ sự bảo vệ mạnh mẽ của loại quyền nào?","sở hữu trí tuệ"
"Một cái gì đó có thể thay đổi ý nghĩa dự định của một tin nhắn là gì?","truyền thống khu vực khác nhau"
"Beyonce đã phát hành bài hát ""Formation"" trên dịch vụ âm nhạc trực tuyến nào?","Tidal"
"Magadha là một trong số mười sáu là gì?","Mahā-Janapadas"
"Khi nào trong đời, Spielberg 'cảm thấy như một người ngoài hành tinh'?","trong thời thơ ấu"
"Thủ đô của Vương quốc Nabatean là gì?","Petra"
"Oliver Cromwell bắt đầu bảo vệ các nhân vật quốc gia trong tu viện bắt đầu từ ai?","Đô đốc Robert Blake"
"Những loại máy bay trực thăng đã được sử dụng cho các cảnh bay?","một máy bay trực thăng Messerschmitt-Bölkow-Blohm Bo 105"
"Độ che phủ của đám mây có ảnh hưởng gì đến lượng năng lượng mặt trời có sẵn?","các đám mây chặn ánh sáng tới từ mặt trời và giảm ánh sáng có sẵn cho pin mặt trời"
"Tính đến tháng 4 năm 2014, Jay Z và Beyonce đã bán được bao nhiêu album?","300 triệu"
"Những loại nông dân sinh sống ở miền đông Tennessee vào cuối thế kỷ 19?","yeoman"
"Đế chế nào đã từ chối sau Chiến tranh Crimea?","Đế chế Ottoman"
"Một số chú chó giúp ngư dân làm gì?","lưới"
"Các cụm hạt nhân nhỏ bao gồm những phần nào của não?","thalamus và vùng dưới đồi"
"Tại quán rượu nào Ronnie Kray giết ai đó vào năm 1966?","The Blind Beggar"
"Có bao nhiêu người ghé thăm dãy núi Alps mỗi năm?","hơn 120 triệu"
"Độ sâu tiêu cự của trận động đất là gì?","19 km"
"Kết quả nào đến từ phân tích sâu sắc của von Neumann về vấn đề đo lường?","vũ trụ vật lý có thể được tạo ra theo chức năng sóng phổ"
"Với những phong cách nào Mughal Rulers hợp nhất văn hoá Tuko-Ba Tư của họ?","Ấn Độ cổ đại"
"Cửa hàng bách hoá Paris đầu tiên được thành lập vào năm nào?","1784"
"Cấu trúc cấp cao nhất của các lực lượng Chopped này trong USAF là gì?","Lực lượng đặc nhiệm thám hiểm không gian và không gian"
"Philadelphia có loại chính phủ nào?","thị trưởng mạnh mẽ của hình thức chính phủ của hội đồng thị trưởng"
"Khi nào việc mua lại Alstom của GE được hội đồng quản trị của Alstom đồng ý?","tháng 6 năm 2014"
"Primark đã điều tra bao nhiêu năm?","ba năm"
"Những câu lạc bộ bóng đá Anh bị cấm thi đấu ở châu Âu vào năm nào?","1985"
"Tại sao sóng địa chấn đi xa như vậy?","độ cứng của địa hình"
"Triều đại đầu tiên của thời kỳ hoàng kim là gì?","Gupta"
"Ai đã cứu cuộc sống của Villa?","Raúl Madero"
"Quốc gia nào muốn tham gia với Ai Cập?","Syria"
"Ga cuối đô thị chính của Meltern là gì?","Flinder Street Station"
"Ai là người cố vấn cho mùa 10 - 12?","Jimmy Iovine"
"Ngoài cờ cá nhân, Elizabeth còn có những loại cờ nào khác?","tiêu chuẩn hoàng gia"
"Có bao nhiêu côn trùng sử dụng parthenogenesis?","Một số côn trùng"
"Chuyến đi lên Mặt trăng kéo dài bao lâu cho phi hành đoàn tàu Apollo 11?","ba ngày"
"Ai đã có một cống phẩm đặc biệt tại đêm chung kết?","Simon Cowell"
"Cho đến năm 1965, Houston Astros được gọi là gì?","Colt .45s"
"Các bộ phận của cây như thế nào trong thời nguyên thuỷ của chúng?","tách biệt với (nhưng tiếp xúc với nhau)"
"Những gì có thể được tái sử dụng sau khi hình thành?","gallium đắt tiền"
"Một quy tắc hypodesecnt là gì?","có nghĩa là những người hỗn hợp chủng tộc được gán trạng thái của nhóm cấp dưới xã hội"
"Năm nào dịch vụ bưu chính ở Somalia tiếp tục?","2013"
"Tên của dòng quần áo Madonna phát hành với con gái là gì?","Material Girl"
"Kanye đã lấy cảm hứng từ ai khi tạo ra những năm 808 & Heartbreak?","Gary Numan, TJ Swan và Boy George"
"Ai chơi Han Solo?","Harrison Ford"
"Ai đã tạo ra các nhạc cụ được sử dụng bởi người Dublin?","luthier Roger Bucknall của Fylde Guitars"
"Có bao nhiêu trường đại học dạng thứ sáu độc lập ở Southampton?","hai"
"Năm nào sự bảo hộ của Anh đối với Somaliland của Anh kết thúc?","1960"
"Ngoài dầu khí, Houston còn được biết đến điều gì?","nghiên cứu y sinh và hàng không"
"Tại sao tuyến đường đầu tiên không được thực hiện?","lo lắng về an ninh"
"Kanye đã thiết kế một chiếc giày có ý nghĩa gì cho Tuần lễ thời trang Paris?","Louis Vuitton"
"Dân số đã được chuyển đổi sang tôn giáo nào?","Công giáo La Mã"
"Trong những năm gần đây, những gì sử dụng đã tăng lên đáng kể?","internet di động 3G / 4G"
"Tên của lý thuyết mà Lange và James đã phát triển độc lập là gì?","lý thuyết James Lange"
"Madaris Ottoman được xây dựng ở đâu?","gần nhà thờ Hồi giáo"
"Ai cảm thấy rằng chủ nghĩa nhân văn chắc chắn sẽ là một ""tôn giáo"" lớn hiện nay?","Ernest Renan"
"Kể tên ba DBMS đã được sử dụng từ những năm 1970.","Adabas, Oracle và DB2"
"Bản án trong phiên toà của Maclean là gì?","không có tội vì lý do điên rồ"
"Vào năm nào một báo cáo được thực hiện để giảm gánh nặng phát triển thuốc?","2012"
"Điều gì không được coi là hợp lệ khi được thực hiện bởi các mệnh giá khác?","phép báp têm trước đó"
"Cuộc bầu cử được tổ chức vào năm nào?","2005"
"Tên của giải đấu bóng rổ trong nước hàng đầu của Hy Lạp là gì?","A1 Ethniki"
"Các hệ thống nhiệt khối lưu trữ năng lượng mặt trời ở dạng nào?","nhiệt"
"Phân loại nào được đưa ra?","cấu trúc chính trị - xã hội"
"Hoá chất gọi là chất dẫn truyền thần kinh được giải phóng ở phần nào của não?","khớp thần kinh"
"Làm thế nào các thí sinh bán kết được chia ra để thực hiện trong phần một?","ba nhóm mười"
"Thông qua bộ phận nào của cơ thể là các chất dinh dưỡng được vận chuyển đến các tế bào nuôi dưỡng?","dòng máu"
"Tôn giáo thống trị của Bắc Phi là gì?","Hồi giáo"
"Phim tài liệu của Beyonce được gọi là gì?","Life Is But a Dream"
"Nếu hành khách không muốn đi tàu đến sân bay, phương tiện nào khác có sẵn?","xe buýt"
"Thảm hoạ tự nhiên nào đã gây ra những ảnh hưởng bất lợi cho khu vực Irrawaddy của Miến Điện vào tháng 5 năm 2008?","Cyclone Nargis"
"Toà nhà nào được sử dụng đầu tiên cho các lớp học tại Đại học Washington?","Benton School."
"Dionysus là ai?","một nhà thần học thần bí"
"Người đoạt giải Nobel Hans Bethe nghĩ gì về khả năng của von NEumann?","Đôi khi tôi đã tự hỏi liệu một bộ não như von Neumann không chỉ ra một loài vượt trội so với con người"
"Liên Xô được tạo ra vào ngày nào?","30 tháng 12 năm 1922"
"Khách sạn nổi tiếng nhất ở Windhoek là gì?","Windhoek Country Club Resort"
"Sự kiện nào trên Tuvalu đã giúp đỡ người dân cần thiết?","Cyclone Pam"
"Vào thời điểm đó, ai chạy tự xưng là chủ tịch hợp pháp của đất nước?","Ialá"
"Các nhà phê bình đã tin gì về ý tưởng của The Sun và Lord Kilbracken về AIDS?","The Sun và Lord Kilbracken đều chọn kết quả từ một nghiên cứu cụ thể trong khi bỏ qua các báo cáo dữ liệu khác về nhiễm HIV và không chỉ nhiễm AIDS"
"Trường hợp Hoa Kỳ & Báo cáo Thế giới xếp hạng Notre Dame trong bảng xếp hạng đại học 2015-2016 của nó ở đâu?","18 tổng thể"
"Người ta nghĩ rằng nhịp sinh học phát triển để bảo vệ?","sao chép DNA"
"Vào năm nào, Seattle Metropolitans giành được cúp Stanley?","1917"
"Điều gì cuối cùng đã khiến cho quyền lực của nhà Tần bị giải thể?","nổi loạn"
"Vào năm nào thành phố có ít hơn 500 vụ giết người?","2007"
"Bao lâu là hình phạt điển hình cho việc chậm trễ?","thường là ba ngày"
"Ai đã hỗ trợ Darwin trong việc nghiên cứu động vật không xương sống biển?","Robert Grant"
"Những loại khí lấp đầy một bóng đèn dây tóc vonfram?","argon hoặc nitơ"
"Vào năm nào, các chương trình phát sóng tin tức hàng ngày ở Sankrit bắt đầu trên Đài phát thanh All India do nhà nước điều hành?","1974"
"Trung tâm Thương mại Thế giới 4 dự kiến ​​có bao nhiêu không gian?","53.500 mét vuông"
"Ân sủng tiết kiệm dựa vào những lý thuyết này là gì?","có những cách thống kê khác để kiểm tra các lý thuyết và các lý thuyết vẫn chưa được bác bỏ."
"Ngoài việc là nhà của chế độ quân chủ và là một điểm thu hút khách du lịch, Cung điện Buckingham còn được biết đến với cái gì khác?","phòng trưng bày nghệ thuật"
"Đội tuyển bóng chuyền quốc gia nam Hy Lạp đến ở vị trí nào trong các trận đấu Olympic?","5"
"Loại nhà thống trị ở Philadelphia là gì?","dãy nhà"
"Định nghĩa của ASCII là gì?","là sơ đồ mã hoá ký tự"
"Các nhà sử học từ quốc gia nào nói riêng không đề cập đến thời Trung cổ muộn?","Ý"
"Truyện tranh Nhật Bản được gọi là gì?","manga"
"Một số kiến ​​trúc sư nổi tiếng nhất đến từ Bồ Đào Nha là ai?","Eduardo Souto de Moura, Álvaro Siza Vieira (cả hai người chiến thắng giải thưởng Pritzker) và Gonçalo Byrne"
