"question","answers"
"Những ban nhạc hậu punk nào bắt đầu phân nhánh thành những thứ như nhạc dub và dance?","Pop Group và Slits"
"Trường hợp tiếp sức kết thúc ở Malaysia?","Petronas mang tính biểu tượng Tháp đôi."
"Điểm của Wcherbund là gì?","để sản xuất các vật thể chế tạo máy chất lượng tốt hơn"
"Từ tiếng Afgan có nghĩa là ""mưa"" là gì?","reën"
"Khi nào E.K. Nhà xuất bản Oklahoma của Gaylord mua WKY Radio?","1928"
"Thương hiệu được bảo vệ ở đâu mà không cần đăng ký?","Ở nhiều quốc gia"
"Các công nghệ năng lượng mặt trời tập trung có điểm gì chung?","một chất lỏng làm việc được làm nóng bởi ánh sáng mặt trời tập trung"
"Điều gì đã kết thúc Chiến tranh Nga-Thổ Nhĩ Kỳ?","hội Berlin"
"Hai số liệu Amiibo nào tải lại kho mũi tên của Link?","Link và Toon Link"
"Người nói tiếng bản ngữ nào dễ bắt chước hơn: quy tắc ngữ pháp hoặc thay đổi âm thanh?","đơn giản"
"Quốc gia nào thách thức tính hợp pháp của Chiến tranh Triều Tiên?","Liên Xô"
"Trường kinh doanh Olin được đặt tên khi nào?","1988"
"John bao vây lâu đài gì?","Roche-au-Moine"
"Họ đã chuẩn bị những gì đã xảy ra với Liên Xô để có được nền kinh tế thị trường?","tan rã"
"Một thuật ngữ khác cho năng lực tâm hồn là gì?","tự do"
"Vinson Massif ở vùng núi nào ở Nam Cực?","Núi Ellsworth"
"Crow hướng Fort nằm ở đâu ngoài thành phố?","phía bắc"
"Những tài sản nào được vitamin B tìm thấy có?","tan trong nước"
"Có bao nhiêu người đến thăm các phòng khám HHC hàng năm?","năm triệu"
"Điều gì phân biệt mạnh mẽ người Pháp với một số dân cư khác là vô tính trên khắp châu Âu?","một alen được chọn"
"Những lớp học nào trong thế kỷ 16 đã chế nhạo cách phát âm tiếng Hà Lan của người dân nông thôn?","các lớp giá"
"Bạn sẽ gọi một loại bia chưa được lọc hoặc tiệt trùng là gì?","Các loại bia được điều hoà Cask"
"GDP của hòn đảo năm 1999-2000 là gì?","£ 12 triệu"
"Độ tuổi nào ứng viên giáo dục đại học được coi là trưởng thành?","trên 23 tuổi"
"Cork thường có bao nhiêu ngày sương mù mỗi năm?","trung bình 97"
"Khi nào nhận thức về madolin ở Mỹ trở nên thông thạo?","1880"
"Ngôn ngữ nào đã được nói trong khu vực đã trở thành Congo?","Bantu"
"Mỗi trận đấu có gì?","một câu chuyện"
"Có bao nhiêu giải đấu thể thao lớn ở Bắc Mỹ?","bốn"
"Dân số của Bronx năm 1900 là gì?","200"
"Trong khu phố nào của Miami là góc của Đại lộ Miami và Phố Flagler?","Downtown"
"Nhân chứng nào đã viết rằng những người này trung thành với xương và sẽ không bỏ cuộc?","Mỹ"
"Trung tâm biểu diễn nghệ thuật ở Midtown được đặt tên theo ai?","Adrienne Arsht"
"Ai đã chiến thắng trận chiến ở Kathmandu?","Vương quốc Gorkha"
"Ai bị chỉ trích vì không xử lý trường hợp Forsyth một cách độc lập?","Hiệu trưởng"
"Bức tranh nào hoành tráng cho nữ khoả thân?","Aphrodite of Cnidos of Praxiteles"
"Nền tảng nào, khi được cải tiến vào những năm 1990, đã chiếm thị phần từ Macintosh?","Wintel"
"John đã làm gì ở Anh?","hệ thống hành chính tinh vi"
"Khoảng bao nhiêu bản ghi âm đã được bán trong năm 2014?","9,2 triệu"
"Các chân của Lightning có bao nhiêu cạnh?","cả hai bên"
"Phong cách pizza New Haven bắt nguồn từ đâu?","Frank Pepe Pizzeria Napoletana"
"Elizabeth đã làm gì sau khi Heath cố vấn cho cô ấy?","bay trở lại Anh"
"Một giáo viên tôn giáo từ trường đại học được đặt tên theo một tu sĩ Dominican đã làm gì vào năm 1839 về ghi chú lịch sử?","Esame Critico sulla dottrina dell"
"Mùa nào được bầu chọn trực tuyến?","mười"
"Comcast đã đầu tư vào công ty thương mại internet nào?","VeriSign"
"Nữ hoàng đã được phát hiện ở đâu trước khi tham gia các cuộc thảo luận với Trident?","De La Lane Studios"
"Các nhà thiên văn học trong khu vực này đã tin gì là trung tâm của vũ trụ?","trái đất"
"Lượng muối đồng nào độc hại ở động vật?","30 mg / kg"
"Kiến trúc cổ điển nào là kiến ​​trúc Georgia dựa trên?","Hy Lạp và Rome"
"Luftwaffe đã mất bao nhiêu máy bay?","41"
"Ai là giám đốc của Học viện Nghệ thuật mà Frédéric đã gặp khi còn ở Düsseldorf?","Friedrich Wilhelm Schadow"
"Trong thế kỷ nào thuật ngữ ""buck"" có thể được truy trở lại?","18"
"Trước John Champion, yếu tố duy nhất được sử dụng để sản xuất kẽm là gì?","calamine"
"Ai phụ trách việc xây dựng Nhà thờ Đức Bà?","Maurice de Sully"
"Điều gì đã bắt đầu phát triển trên Gondwana khi nó di chuyển qua cực nam?","mũ băng"
"Một công dân Macau đã bị bắt vì đăng lời cầu xin làm gián đoạn cuộc tiếp sức trên trang web nào?","cyberctm.com"
"Henry Hudson làm việc cho ai?","Dutch Công ty Đông Ấn"
"Prothrorax là phân khúc của côn trùng?","trước"
"Khi nào trường âm nhạc và khán phòng Wanda L Bass được mở?","tháng 4 năm 2006"
"Ai đã viết ""Charleston""?","Chris Smith"
"Những bộ lạc di cư đến vùng cao nguyên Iran trong Thế kỷ thứ 10?","bộ lạc Turkic"
"Bao nhiêu phần trăm hộ gia đình ở Atlantic City được tạo thành từ các cá nhân?","37,5%"
"Triệu chứng vật lý nào đi kèm với những tiết lộ của Muhammad?","cơn động kinh"
"Sân bay quốc tế Quần đảo Marshall nằm ở đâu?","Majuro"
"Ai bị tàn sát không thương tiếc bởi Aeneas?","Turnus"
"Những năm nào cuộc chiến tranh cách mạng Mỹ kéo dài?","1775"
"Nhà sản xuất đồ uống lớn nào đã quyết định bắt đầu American Idol không trở thành nhà tài trợ?","PepsiCo"
"Indvuna là gì vì nó liên quan đến Nghị viện Swaziland?","Người đứng đầu khu vực bầu cử"
"Một tên khác cho Circuit Recardo Tormo là gì?","Circuit de Valencia"
"Tên của nhà thờ cổ nhất ở Plymouth là gì?","St Andrew's"
"Những gì các nhà khoa học có thể khấu trừ từ hướng của cuộc đình công?","chuyển động của sông băng"
"Ấn Độ giáo được coi là loại tôn giáo nào?","dharmic"
"Một cuốn sách là De Materia Medica dài bao nhiêu?","năm tập"
"Tên một cách quy định chọn quán rượu của họ?","vì sự gần gũi với nhà hoặc nơi làm việc"
"Điều gì phản đối hành động khẳng định tin rằng nên là chìa khoá chính trong việc xác định sự chấp nhận trong việc làm hoặc giáo dục?","bằng khen"
"Năm 1880, có bao nhiêu vũ trường ở Paris?","150"
"Malaysia hiện có bao nhiêu học viện bách khoa?","32"
"Trong cuộc chiến nào Đế quốc Đức đã bị đánh bại?","Thế chiến I"
"Những gì được gọi là phe phái của một số người?","Các đảng chính trị"
"Con tàu nào đã làm Nữ công tước xứ Cambridge christen vào ngày 13 tháng 6 năm 2013?","Công chúa Hoàng gia"
"Khi nào là khu vực dưới đế chế Tây Tạng và CHinese?","650 Hoá680"
"Bộ phim nào ảnh hưởng đến Beyonce đối với các chủ đề trao quyền?","Dreamgirls"
"Bhrikuti nói sống ở thế kỷ nào?","7th"
"CANSOFCOM có nghĩa là gì?","Bộ chỉ huy lực lượng hoạt động đặc biệt Canada"
"Học viện công nghệ nào đã mở tại Bursa năm 2010?","Bursa Technical University"
"Các đặc điểm của công dân tự do là gì?","họ phục vụ trong dân quân và bỏ phiếu"
"Ngoài những người lớn sống trong nghèo đói, còn điều gì khác được coi là hạn chế kinh tế xã hội dẫn đến giảm cơ hội lựa chọn thực phẩm lành mạnh?","mức độ thấp giáo dục"
"Điều gì cũng được thúc đẩy bởi kết quả của sarmatism?","hoà bình và chủ nghĩa hoà bình"
"Tiêu đề của cuốn sách và bộ phim về cuộc nổi dậy của Mogadishu là gì?","Black Hawk Down"
"Ngôn ngữ, trang phục, hành vi và lựa chọn không gian bị ảnh hưởng bởi sự công nhận của nhóm nào?","các sinh vật xã hội khác"
"Khi nào samurai trở nên ít giống chiến binh hơn?","Trong thời Mạc phủ Tokugawa"
"RMS St Helena có kiểu bố trí nào?","bố trí hàng hoá / hành khách hỗn hợp."
"Do Thái giáo thuộc loại tôn giáo nào?","độc thần"
"Những khu vườn của New Delhi đặc biệt tuyệt đẹp vào mùa nào?","mùa xuân"
"Super NES có bao nhiêu chân trong đầu nối độc quyền của nó?","12"
"Chiến dịch du kích Úc và Hà Lan dẫn đầu ở đâu?","Timor Bồ Đào Nha"
"Nghề gì nghiên cứu vai trò của cảm xúc trong việc cung cấp chăm sóc sức khoẻ toàn diện?","Điều dưỡng"
"Nghiên cứu về các sinh vật sống được gọi là gì?","sinh hoá"
"Martin Luther sẽ viết về sự sùng kính nào của Công giáo sau 95 luận văn /","Virgin Mary"
"Ganondorf nằm ở đâu sau thất bại của Zant?","Hyrule Castle"
"Có bao nhiêu tổ chức nghiên cứu hợp đồng ở San Diego?","140"
"Những cài đặt bass nào là cần thiết để loại bỏ hum?","dưới 100 Hz"
"Cuộc tổng tuyển cử Hàn Quốc được tổ chức khi nào?","10 tháng 5 năm 1948"
"Tufts- Trung tâm y tế mới của Anh được đổi tên thành gì?","Trung tâm y tế Tufts"
"Sự kiện nào đã khiến Câu lạc bộ Thuyền thành công cao tại?","hắng tại Henley"
"Bữa trưa của Louis được tìm thấy khi nào?","1895"
"Đó là sân vận động bóng đá lớn nhất nước Mỹ trên thế giới?","Sân vận động Michigan"
"Có bao nhiêu dân tộc hoặc cơ quan liên bang cần sử dụng trong việc thu thập dữ liệu?","tối thiểu hai"
"Khi nào Basel II được thông qua?","2005"
"Kể tên một quốc gia có hệ thống chính trị độc đảng.","Trung Quốc"
"Một tính năng độc đáo của các kỷ lục thế giới là gì?","phát từ bên ngoài vào bên trong"
"Tên của nơi cư trú nơi tình nguyện viên được đặt là gì?","Bethel"
"Tạp chí nào có bài viết mà Michael Lewis đã nói chuyện với một thương nhân về các khoản nợ xấu?","Tạp chí danh mục đầu tư"
"Ai đến để bảo vệ Nhà Trắng?","Muscovites"
"Có tình trạng miễn thuế này áp dụng cho các loại thuế khác?","phải trả thuế liên bang cho thu nhập không liên quan đến mục đích được miễn thuế của họ"
"Chủ đất được khuyến khích di cư đến đâu?","biên cương"
"Các cấp độ Somerset là gì","là một vùng đất ngập nước dân cư thưa thớt ở trung tâm Somerset, giữa các ngọn đồi Quantock và Mendip"
"Palau de la Generalitat ở Barcelona được xây dựng khi nào?","được xây dựng vào thế kỷ 15"
"Điều gì là nghèo về các khu vực nội địa như Tứ Xuyên?","Chăm sóc sức khoẻ"
"Từ Hi chết năm nào?","1908"
"Các ngã ba lý tưởng điện áp chuyển tiếp là gì?","thấp điện"
"Cách Trung tâm Kiến trúc Virginia cách Bảo tàng Trẻ em Richmond bao xa?","hai khối"
"Ai đã vượt qua một phần của oklahoma và texas?","Hernando de Soto"
"Ai đã viết Anarchy, State và Utopia?","Robert Nozick"
"Loại đàn mandolin nào đã trở nên phổ biến vào những năm 1930?","mandolins đơn"
"Điều gì khiến các phi hành đoàn kéo và dịch vụ cứu hộ mất kiểm soát trong khi giàn khoan Kulluk đang vận chuyển đến Washington?","một cơn bão mùa đông"
"Quy mô của Khu Phát triển Kinh tế và Công nghệ Thành Đô là gì?","CETDZ"
"Có bao nhiêu dặm dài là Metrorail?","24,4"
"Điều gì bao gồm hầu hết các nghệ thuật ban đầu của Mexico City?","mật mã"
"Những tạp chí cung cấp đánh giá cho thiết bị âm thanh?","Độ trung thực và âm thanh cao"
"Elizabeth đã trở thành Nữ hoàng bao nhiêu năm?","60 năm"
"Công ty dược phẩm nào đóng vai trò là nhà cung cấp việc làm lớn cho New Haven?","Alexion"
"Hoa Kỳ chia sẻ biên giới nước với ai ở phía tây bắc?","Nga"
"Thời gian đóng đinh mỗi Mark là mấy giờ?","9 giờ sáng"
"Cuộc sống của ai là 'Danh sách của Schindler' dựa trên?","Oskar Schindler"
"Nếu Thủ tướng Vương quốc Anh bị bệnh ở thành phố New York, ông sẽ đến bệnh viện nào?","Bệnh viện Bellevue"
"Năm nào Newell xuất hiện tại cuộc họp báo EC3 của Sony để lấy lại những gì ông nói về PS3?","2010"
"Sự kiện nào tạo ra sự mở rộng của ngành công nghiệp bông Anh?","Cách mạng công nghiệp"
"Điều gì được cho là máy tính tương tự cơ học đầu tiên?","Cơ chế Antikythera"
"Căn cứ tạo nên sự tập trung lớn của thuỷ quân lục chiến và thuỷ thủ trên thế giới nằm ở thành phố NC nào?","Jacksonville"
"Quốc gia nào có dân số Somalia lớn thứ hai?","Ethiopia"
"Nguồn tài liệu giáo dục trong các trường đại học thời kỳ đầu hiện đại là gì?","chương trình giảng dạy và nghiên cứu thời trung cổ"
"Khi nào là Ngày của trẻ em?","1 tháng 6"
"SADP được đặt ở đâu?","Marvin Hall"
"Công viên Rendezvous ở đâu?","Mesa"
"Những địa điểm khác nổi tiếng với mùa xuân vượt qua?","Spurn ở Anh"
"Dell đã tăng số tiền ngân sách dịch vụ khách hàng của mình lên bao nhiêu?","$ 150 triệu"
"Cảng cá nào của Nhật Bản là thứ hai của Galicia?","Tokyo"
"Dự luật trở thành luật khi nào?","tháng 11 năm 1994"
"Gautama không thích giáo lý tôn giáo mà ban đầu ông tìm thấy vì lý do tại sao?","họ không cung cấp một kết thúc vĩnh viễn cho đau khổ"
"Vào năm nào thì một thoả thuận đạt được để cấm khai thác ở Nam Cực?","1998"
"Man in Space Soonest là một chương trình của tổ chức nào?","Không quân Hoa Kỳ"
"Những loại ánh sáng có thể được gắn trên trần nhà để xuất hiện tuôn ra?","Ánh sáng lõm"
"Những gì được sử dụng để xây dựng lại các tế bào?","phân tử hữu cơ"
"Có bao nhiêu dây dẫn có mặt trong cơ sở của bóng đèn?","hai (hoặc nhiều hơn)"
"Có gì trên boong tàu sân bay Nhật Bản khi tàu lặn Mỹ tấn công?","đạn"
"Beyoncé đã mang thai ở đâu?","Paris."
"Khi nào các tu sĩ ở tu viện Drepung và Sera bắt đầu phản đối độc lập?","1989"
"Những hoạt động phổ biến ở vùng núi của Tucson?","đi xe đạp, đi bộ đường dài, leo núi, cắm trại, Chim, và trượt tuyết mùa đông và trượt tuyết"
"10/13 dựa vào đâu?","Boulder, Colo."
"Bao nhiêu phần trăm bộ gen của ruồi giống với bộ gen của con người","70%"
"Cơ quan nào cũng dừng tồn tại sau một cuộc bỏ phiếu để tự kết thúc?","thượng viện Liên Xô tối cao,"
"Khoảng thời gian nào đánh dấu sự khởi đầu của văn hoá thời đại đồ đá mới?","10.200 - 8.800 trước Công nguyên"
"Bao nhiêu phần trăm dân số dưới 30 tuổi?","70%"
"Có bao nhiêu lễ rửa tội trong năm 1974?","hơn 297.000"
"Con số Amiibo nào khiến Link mất nhiều sức khoẻ hơn khi bị tấn công?","Ganondorf"
"Những gì đã phần nào trở thành một phong cách quốc tế vào đầu thế kỷ 21?","phong cách quần áo phương Tây"
"Ai làm Bí thư Tỉnh uỷ báo cáo?","Tổng thư ký của bang Punjab"
"Tổng chi phí ước tính của dự án máy bay trực thăng Chinook là gì?","£ 500 triệu"
"Tại sao Schumann nói người Ba Lan đang chịu tang?","thất bại của tháng 11 năm 1830"
"Những tác phẩm của nhà thơ người Estonia nào được in từ năm 1810 đến 1820?","Kristjan Jaak Peterson"
"Loại phần mềm nào được lưu trữ trong chip BIOS?","BIOS được thiết lập"
"Phố Đông Thứ nhất nằm ở đâu?","Bảng chữ cái"
"Hy Lạp và ESA đã ký thoả thuận đầu tiên vào năm nào?","1994"
"Bao nhiêu phần trăm của tiểu bang là Trắng?","89,4%"
"Những ngôn ngữ di Radio Mogadishu ban đầu phát sóng?","Somali và Ý"
"Tại sao gia đình Victoria không chấp nhận Abdul Karim?","làm gián điệp cho Liên đoàn Yêu nước Hồi giáo, và thiên vị Nữ hoàng chống lại người Ấn giáo"
"Ngoài Điều tra dân số, lựa chọn ""một số chủng tộc khác"" còn ở đâu nữa?","Khảo sát Cộng đồng Hoa Kỳ"
"Người Hồi giáo gọi tháng là gì khi họ nhịn ăn giữa mặt trời mọc và mặt trời lặn?","Ramadan"
"Ở dạng nào thì một số virus lưu trữ toàn bộ bộ gen của chúng?","dưới dạng RNA"
"Ai được đặt tốc độ bit cho tệp MP3?","người tạo"
"Vào năm nào, đảng Tự do giành chiến thắng lớn trong cuộc tổng tuyển cử?","1906"
"Thoả thuận tháng 3 năm 2013 đã quyết định điều gì?","tách ngân hàng lớn thứ hai của đất nước"
"Sự thiếu hụt thành phần của năm 1989 đã buộc Allan Loren phải làm gì với máy Mac?","giảm giá"
"Năm 1914, phần bổ sung được trả tiền riêng cho The Times là một tạp chí có nội dung thuộc loại nào?","hàng tuần"
"Làm thế nào thường làm chim lột xác?","thường mỗi năm một lần"
"Ở Phillipines, địa nhiệt đại diện cho bao nhiêu phần trăm của tổng công suất hỗn hợp vào cuối năm 2008?","17%"
"Ý tưởng nào đã làm nhà vô địch Albertus?","kiến ​​thức tích cực về Thiên Chúa là có thể"
"Trong ấn phẩm nào là phim hoạt hình đầu tiên được sử dụng để mô tả minh hoạ bảng đơn gag?","Punch"
"Khi nào thì Đảo bắt đầu trải qua thời kỳ thịnh vượng?","1770"
"Eagle Rock và Dans Mountain cao bao nhiêu?","3.162 ft (964 m) và 2.882 ft"
"Tổ chức nào ủng hộ một chương trình cải cách cơ cấu?","IMF"
"Ai là vị vua trị vì đầu tiên từ Anh đặt chân đến Tây Ban Nha?","Victoria"
"Trong thập kỷ nào, hip-hop bắt đầu được xuất hiện trên radio?","1980"
"Giả định nào cho rằng bức xạ vật đen là thứ dẫn đến một dự đoán chính xác?","nhiệt"
"Những loại sợi mạnh là một phần của hỗn hợp gỗ?","cellulose"
"Trong bài phát biểu, Truman đã đưa ra tuyên bố rằng mỗi người đàn ông nên được đảm bảo những gì?","bình đẳng về cơ hội"
"PVA vận chuyển vật tư tại một điểm như thế nào?","đi bộ và xe đạp"
"Mục đích của cáp USB đầu vào kép là gì?","một đầu vào được sử dụng để cấp nguồn và truyền dữ liệu, còn lại chỉ dùng cho nguồn điện"
"Những gì được săn từ lưng của một con voi?","hổ hổ"
"Ai rời Fort Watuaga, vượt qua Appalachia và tấn công quân đội Anh ở Nam Carolina năm 1780?","Overmenez Men"
"Cuộc thi capella được tổ chức tại UC Berkeley là gì?","Anahat"
"Chủ tịch của Knorr được đánh dấu bằng việc sử dụng ngày càng tăng là gì?","hướng dẫn rõ ràng hướng dẫn Nhân Chứng"
"Nasser đã loại bỏ hoàn toàn khỏi Ai Cập?","ảnh hưởng của Anh"
"Bao nhiêu dân số của Detroit là người da đen?","82%"
"Trong thập kỷ nào, sự tập trung của Whitehead bắt đầu tránh xa toán học?","1910"
"Những tư tưởng chính trị nào làm cho các tác phẩm chính của Popper bảo vệ?","chủ nghĩa tự do dân chủ"
"Tên của người đóng góp đáng chú ý cho các cột Tạp chí Thời đại đã trở thành Nhà văn Thực phẩm và Đồ uống của Năm 2005 là gì?","Giles Coren"
"Nhóm này muốn có trách nhiệm cho sự kiện năm 1989?","Thiên An Môn"
"Nghệ sĩ nào đã tạo ra bia khắc Street và Gin Lane?","William Hogarth"
"Nơi nào tổ chức tiệc nhà nước?","Phòng khiêu vũ"
"Loại gia cầm nào được nuôi phổ biến nhất?","hơn một nửa số này trong các đơn vị sản xuất công nghiệp, giống như nhà máy"
"Chính phủ Hà Lan sợ làm gì nếu họ dạy thuộc địa Hà Lan?","gây mất ổn định thuộc địa"
"Khi nào kết quả cho thấy xảy ra?","đêm hôm sau"
"Bức thư cũ đã trở thành gì?","у⟩"
"Ai được coi là người ban hành luật?","chủ quyền"
"Jeff Foley đã chơi cho đội nào?","Albany Firebirds"
"Khi nào Thổ Nhĩ Kỳ và Israel thiết lập quan hệ ngoại giao đầy đủ?","1991"
"Grand Orient de France được coi là loại hình tự do nào?","Tự do"" hoặc Tự do lục địa"
"Đầu nối loại A thường có kích thước bao nhiêu?","trình kết nối Loại A thường có kích thước đầy đủ"
"Có phải tất cả các công việc được thực hiện bởi trẻ em được coi là lao động trẻ em?","Những luật này không coi tất cả các công việc của trẻ em là lao động trẻ em"
"Năm nào von Neumann được chẩn đoán mắc bệnh ung thư?","1955"
"Khi nào Madonna biểu diễn tại buổi hoà nhạc lợi ích Live 8 ở Anh?","tháng 7 năm 2005."
"Có bao nhiêu phường tạo nên Cork?","sáu phường bầu cử"
"Thực phẩm chú trọng vào hải sản, muối và sữa là một ví dụ của những gì?","ẩm thực khu vực"
"Sự kiện nào vào tháng Hai đã giúp Barcelona đủ điều kiện lần thứ sáu?","Copa del Rey"
"Nhiều người ở Đức vẫn muốn làm gì?","Lồng ghép người Áo"
"Tổng chi phí của đường cao tốc Sui-Yu là bao nhiêu?","1,045 tỷ nhân dân tệ"
"Lần đầu tiên một trận bóng đá Anh được phát sóng qua internet vào năm nào?","2009"
"Một hiệp ước có thể bị chính trị hoá do những bất đồng trong một đảng vì sự phân chia giữa một hiệp ước tự thi hành và một hiệp ước không tự thi hành thường có thể được mô tả như thế nào?","không rõ ràng"
"Yao Ming đã quyên góp bao nhiêu?","$ 214,000 và $ 71,000"
"Những loại hiện tượng nghiên cứu khoa học?","hiện tượng thế giới thực"
"Tâm lý giáo dục chiếm ưu thế từ những năm 1750 trở đi là gì?","chủ nghĩa cộng sản,"
"Làm thế nào để hạt trở thành mạch nha?","bằng cách ngâm nó trong nước"
"Beyonce tham gia cùng 2 người phụ nữ khác trong danh sách nào từ tạp chí Billboard năm 2011?","Top 20 ca sĩ nổi tiếng nhất"
"Toà thị chính New York được tìm thấy ở quận nào?","hính ở Manhattan"
"Gladstone từ chức năm nào?","1885"
"Các triều đại phía Nam và Bắc là khi nào?","420 - 589 CE"
"Kể từ ngày nào tiếng Phạn được cung cấp dưới dạng tuỳ chọn ngôn ngữ ở Hoa Kỳ?","tháng 9 năm 2009"
"Kênh nào được phát sóng 'Terra Nova'?","Fox"
"Loại nhiệt độ nào là điển hình vào một buổi sáng ở Kathmandu?","mát"
"Ở quận nào thuỷ tinh có hàm lượng oxit urani được tìm thấy?","Italy"
"Ngôn ngữ nào là parl?","Balearic"
"Quang phổ của các vị thần bạn có thể nhận được ở Mexico City là gì?","thực phẩm cơ bản đến hàng hoá cao cấp cực kỳ cao cấp"
"Những gì hai nền văn hoá tiền gốc Tây Ban Nha đã tồn tại đến thời điểm này?","chenchule 'và inafa'maolek"
"Làm thế nào mà người Anh đảm bảo sự vượt trội về mặt số trong việc chiếm Louisbourg?","quân tiếp viện của Pháp bị chặn lại bởi chiến thắng của hải quân Anh trong Trận chiến"
"Những văn bản ngôn ngữ nào nhiều như 70% tiếng Phạn?","Tiếng Telugu"
"Anna Lelkes đã chơi nhạc cụ nào?","đàn hạc"
"Tên của công viên quốc gia ở Old West Tuscon là gì?","Saguaro National Park West"
"Sự cân nhắc đầu tiên cho OKL để hỗ trợ Chỉ thị 23 là gì?","khó khăn trong việc ước tính tác động của ném bom khi sản xuất chiến tranh"
"Thống đốc Tây Ban Nha bị trục xuất năm nào?","1814"
"Loại ""kho"" nào là ROM BIOS trong PC?","phần mềm"
"Truyền hình được đặt ở đâu?","trên đỉnh"
"Thành phố nào có điểm HDI thấp nhất trong quận liên bang?","Iztapalapa"
"Ai cho thấy hoá thạch Nam Mỹ tuyệt chủng có liên quan đến các loài sống?","Richard Owen"
"Cấu trúc của Đại học Paris phục vụ như những gì cho các trường đại học khác?","một tiêu chuẩn"
