"question","answers"
"Trong khi doanh số Windows giảm, công ty nào có doanh số tăng?","Apple"
"Điều gì đã khiến chủ nghĩa lãng mạn kết thúc?","Chủ nghĩa thực chứng"
"Trung Quốc đã xuất khẩu những gì?","chè, lụa và sản xuất"
"Khu vực lớn nhất của nền kinh tế Hy Lạp là gì?","lĩnh vực dịch vụ"
"Phần khảm lớn nhất vẫn còn hiện diện trong Nhà thờ Hồi giáo Umayyad là gì?","""Bảng điều khiển Barada"""
"Những loại trận đấu bóng đá là không cạnh tranh?","friendlies trước mùa giải"
"Tại sao người Pháp và tiếng Anh không thể kiểm soát lĩnh vực này?","thiếu thiết bị"
"Những cuộc đột kích nào đã quấy rầy Hamwic trong thế kỷ thứ 9?","Viking"
"Nhà khoa học nào đã sử dụng cơ học ma trận để đưa hành vi điện tử phù hợp với mô hình Bohr?","Heisenberg"
"Những gì các nhà môi trường muốn ban hành?","quy định chặt chẽ hơn"
"Một thuật ngữ khác cho hành động gián điệp cho một quốc gia khác là gì?","gián điệp"
"Là rượu sử dụng một cơ chế kiểm soát cảm xúc tích cực hay tiêu cực?","tiêu cực"
"Khi nào Kim Il-Sung gọi cho hội nghị Haeju?","1950"
"Ai được phép đưa ra ""những sự thật mới"" dựa trên đầu vào của chư Phật?","tu sĩ"
"Sao Hải Vương cách Mặt Trời bao xa hơn Sao Thiên Vương?","50%"
"Ai là người đứng đầu toà án tối cao?","Chánh án Liberia"
"Cái gì đã được sử dụng để lấp đầy một cái ao nhà máy đã trở thành Quảng trường Haymarket?","vương miện của Beacon Hill"
"Boston đã bị Salem, Massachusetts vượt qua trong loại hình thương mại nào?","buôn bán nô lệ"
"Vật liệu nào hấp thụ ánh sáng mặt trời và tạo ra nhiệt độ cao hơn vật liệu tự nhiên?","nhựa đường và bê tông"
"Sahara có gì ít?","Vùng phía bắc và phía nam của sa mạc"
"Ai được biết đến như một người sáng lập tư tưởng nhân văn ở Trung Quốc?","Hoàng đế vàng"
"Cuộc bầu cử năm 1999 được coi như thế nào?","không đồng ý và không công bằng"
"Ai trở thành tổng thống năm 2013?","Michel Djotodia"
"Vương quốc Israel bị Đế quốc Neo-Assyrian chinh phục khi nào?","sau 720 BCE"
"Sáu công ty đã tạo ra một số thiết bị ngoại vi đầu tiên cho iPod là gì?","Công nghệ Griffin, Belkin, JBL, Bose, Monster Cable và SendStation"
"Bao nhiêu phần trăm nam giới trì hoãn ghi danh BYU của họ để phục vụ như một nhà truyền giáo Mặc Môn?","88"
"Ai đã làm việc trên cùng một loại ứng dụng quy mô lớn của các mạch in như Hoa Kỳ ở Anh vào giữa những năm 1950?","Geoffrey Dummer"
"Có bao nhiêu người lưu vong Tây Tạng được cho là ở Ấn Độ?","150"
"Các trường anh chị em của BYU nằm ở đâu?","Hawaii và Idaho"
"Bao nhiêu phần trăm dân số Do Thái của Pháp sống sót sau vụ thảm sát?","75"
"Album thứ ba của Kanye West được phát hành vào năm nào?","2007"
"Ai đã biểu diễn bài hát ""Unbreak My Heart""?","Toni Braxton"
"Lý thuyết nào nói rằng chạy đường dài đã thúc đẩy sự tiến hoá của một số đặc điểm của con người?","giả thuyết chạy bền"
"Bao nhiêu phần trăm dân số có được bằng đại học?","12,8%"
"Thuyết độc thần là gì?","niềm tin vào sự tồn tại của một Thiên Chúa"
"St. Barts có bao nhiêu khách sạn?","25"
"Tiểu bang Úc nào từng được gọi là tiểu bang vườn?","Victoria"
"Điều gì chiếm phần lớn nền kinh tế của Uruguay?","Du lịch"
"Triển lãm Thuyền Thuyền được tổ chức vào tháng nào mỗi năm?","tháng 9"
"Sự kiện nào đã kết thúc ""thời kỳ kinh điển""?","cái chết và sự thất bại của Hoàng đế Aurangzeb"
"Gaddafi tin rằng nên thành lập loại nhà nước nào?","pan-Arab"
"Vị tướng nào đã bị đánh bại năm 1920?","Tướng Pyotr Wrangel"
"Làm thế nào mà mọi người biết rằng Alexander đã chọn Athanasius làm người kế vị?","ba lần nhắc lại tên ông"
"Có bao nhiêu người chiến thắng Idol đã đến từ miền Nam nước Mỹ?","mười"
"Ảnh hưởng của đập đối với các ứng suất trong khu vực đó là gì?","gấp 25 lần"
"Vào năm nào, lần đầu tiên Richmond có thể được cho là đã phục hồi sau sự huỷ diệt của Cách mạng Mỹ?","1782"
"Philadelphia đã có loại nền kinh tế nào?","công nghiệp"
"Chữ cái nào đại diện cho chỉ số khúc xạ?","n"
"Một ngôi đền dành riêng cho Apollo Medicus ở đâu?","Rome"
"Những loại vỉa hè lát gạch trong nhà chương?","giữa thế kỷ 13"
"Chopin được ghi nhận là giới thiệu âm nhạc để làm gì?","ý nghĩa mới về chủ nghĩa dân tộc"
"Quân đội Thổ Nhĩ Kỳ đã làm gì để đáp trả cuộc đảo chính?","đã xâm chiếm hòn đảo"
"Những vấn đề với việc làm mà phi lợi nhuận phải đối mặt?","Cạnh tranh cho nhân viên với khu vực công và tư"
"Đảo Norfolk có liên quan gì đến Úc?","phía đông"
"Bombycilla đang di chuyển để đáp ứng với những gì?","thời tiết mùa đông và mất thức ăn mùa đông thông thường"
"Làm thế nào để Dusky grouse di cư?","chủ yếu bằng cách đi bộ"
"Từ đâu mà việc thực hành liên kết các vị thần khác nhau thành nhóm?","gốc Hy Lạp"
"Steven Spielberg đã có sự nghiệp bao lâu rồi?","hơn bốn thập kỷ"
"Những gì thường cao hơn trong một cơn gió mùa so với phần còn lại của năm?",""
"Khi nào Ariel Sharon trở thành thủ tướng?","2001"
"Những gì giải phóng tinh trùng từ annelids?","nephridia"
"Andrew Petersen nói gì về việc ban đầu được biết đến như là gì?","Baghnagar (thành phố của những khu vườn)."
"Khi nào Armenia bắt đầu giành huy chương Olympic?","1952"
"Tên của cuốn sách mà Darwin đã viết về sự tiến hoá là gì?","On the Origin of Species"
"Kerry định nói gì khi anh ta 'đùa giỡn'?","""... cuối cùng bạn sẽ khiến chúng ta bị mắc kẹt trong một cuộc chiến ở Iraq. Hãy hỏi Tổng thống Bush."""
"Bao nhiêu phần trăm sinh viên đại học sống trong khuôn viên trường Đại học Washington?","Hơn 50%"
"Ai đã lên án Microsoft vì đã yêu cầu các thiết bị phải bật khởi động an toàn theo mặc định?","những người hỗ trợ phần mềm miễn phí"
"Điều gì xảy ra với phần nhúm của màng ngoài?",", tạo thành các cấu trúc hình cầu được làm bằng một lớp lipid kép bao quanh các vật liệu periplasmic"
"Làm thế nào để cả Chúa Jesus và Vua Carnival làm một món quà cho mọi người?","với cái chết của họ"
"Loại lý thuyết nào là sai lệch nhất?","đơn giản nhất"
"Quận nào là nhà của Nhà trọ Quân đoàn súng trường Cheshire thứ 13 cũ?","Cheshire"
"Những đóng góp của Von Neuman cho lĩnh vực điện toán là gì?","Kiến trúc Von Neumann, lập trình tuyến tính, máy tự sao chép, điện toán ngẫu nhiên"
"Màu gì là ngoại thất của Bugatti Veyron Grand Sport Vitesse của Schwarzenegger?","bạc"
"Thủ đô của nhà nước Abbasid là gì?","Baghdad"
"Mô tả lệnh của Công tước xứ Brunswich-Bevern.","một cột gồm 18.000 người"
"Hộp mực trò chơi SNES chính thức được gọi ở Mỹ là gì?","Game Pak"
"Các mục tiêu của quan hệ đối tác trường độc lập và nhà nước là gì?","nâng cao thành tích học sinh, nâng cao lòng tự trọng của học sinh, nâng cao khát vọng của học sinh và cải thiện thực hành nghề nghiệp trong các trường học"
"Là tuổi mang lại một mong muốn lớn hơn hoặc nhỏ hơn để uống cho niềm vui hơn là đối phó?","ham muốn"
"DeCarlo cũng chấp bút hạ gục siêu sao truyện tranh tuổi teen nào?","Archie Andrew"
"Khi nào nhân học được sử dụng như một thuật ngữ để giải phẫu so sánh?","1838"
"Vị trí nào đã được Tướng MacArthur nắm giữ tại thời điểm này?","Tham mưu trưởng Quân đội"
"Chó hoang có phân loại Latin gì?","Canis dingo"
"Kết quả của cuộc bầu cử năm 2010 đã được Liên Hợp Quốc chấp nhận?","Liên Hợp Quốc (LHQ) và một số nước phương Tây đã lên án các cuộc bầu cử là gian lận."
"Nhóm nào náo loạn tại các nhà máy dệt?","cộng sản"
"Tỉnh nào của Canada là một người tiêu dùng lớn của chương trình Detroit?","Ontario"
"Theo lập luận của Clark, nước trong một cái xô, treo từ một sợi dây và kéo thành sợi, sẽ bắt đầu bằng loại bề mặt nào?","phẳng"
"Trong thời kỳ chiếm đóng của Đế chế La Mã ở Quần đảo Anh, tên của những người sống ở Ireland là gì?","Hiberni"
"Khi nào là cuộc tranh luận phó tổng thống duy nhất được tổ chức tại Đại học Washington?","ngày 2 tháng 10 năm 2008"
"Với sự giúp đỡ của mẹ, Kanye đã tạo ra nền tảng nào sớm trong sự nghiệp của mình?","Kanye West Foundation"
"Taliban đã tập hợp lại ở đâu vào năm 2002?","miền tây Pakistan"
"Triangle Transit cung cấp những gì?","dịch vụ xe buýt đi lại trong khu vực và tuyến cố định"
"Mu Ying đã bắt được bao nhiêu tù nhân Tây Tạng?","30"
"Làm thế nào nhiều thùng đã làm tính năng mitrailleuse?","ba mươi bảy nòng"
"Thành phố nào trong tiểu bang vượt quá một triệu?","Ciudad Juárez"
"Cùng với màu đỏ và màu xanh, kênh màu thứ ba có thể nhìn thấy là gì?","xanh"
"Những công ty khác đã làm MCA sản xuất đĩa cho?","Paramount, Disney và Warner Bros"
"Kể tên 8 người bắt đầu phong trào","Georges Braque và Pablo Picasso, cùng với Jean Metzinger, Albert Gleizes, Robert Delaunay, Henri Le Fauconnier, Fernand Léger và Juan Gris."
"Các BJT có bao nhiêu lớp chất bán dẫn?","ba"
"Thành phố Oklahoma là một phần của?","Great Plains"
"Toà án tối cao Ireland ngồi ở đâu?","Bốn toà án ở Dublin"
"Ai nói với truyền thông rằng các nhà ngoại giao Trung Quốc đang sắp xếp một ""chương trình sức mạnh hoà bình""?","Zhang Rongan"
"Ai đã làm cho Sultan Quli nổi dậy chống lại?","Vương quốc Hồi giáo Bahmani"
"Bộ phim nào Daviau lần đầu làm việc với Spielberg?","Amblin"
"Schwarzenegger bao nhiêu tuổi khi giành được giải Olympia năm 1970?","23"
"Có bao nhiêu ký tự được chọn bởi các giám khảo trong phần tám?","bốn"
"Sau khi các nghi lễ ""sắp ra mắt"" của WWII được thay thế bằng sự kiện nào?","chiêu đãi buổi chiều ít trang trọng hơn"
"Quán rượu nào đã được Freddie Mercury ghé thăm?","Nhà công cộng Coleherne"
"Cùng với Benihana và Burger King, chuỗi nhà hàng nào có trụ sở tại Miami?","Tony Roma's"
"Rita Ranch cũng có một kế hoạch phát triển gọi là gì?","Civano"
"Thành viên cũ nào của Extreme từng là ca sĩ chính của Van Halen?","Gary Cherone"
"Những lý do dẫn đến sự suy giảm của lao động trẻ em là gì?","thay đổi tài chính trong nền kinh tế, thay đổi phát triển công nghệ, tăng lương và các quy định liên tục về pháp luật nhà máy"
"Vương quốc Macedonia bị chia cắt thành bao nhiêu nước cộng hoà?","bốn nước cộng hoà khách hàng"
"Gian hàng mở cửa vào năm nào?","1841"
"Comcast đã trả gì cho cổ phần của họ trong NBC?","6,5 tỷ đô la tiền mặt và 7,3 tỷ đô la cho lập trình"
"Những gì chạy vuông góc với các đường thẳng?","chainlines"
"Là giải thoát khỏi luân hồi có thể?","Theo quan điểm của Phật giáo, giải thoát khỏi sinh tử là có thể bằng cách đi theo con đường Phật giáo."
"Tên của vệ tinh mà tín hiệu của BBC được gửi đi là gì?","Astra 2D"
"Một cuộc nổi dậy của người Hồi giáo diễn ra vào năm 1995 ở đâu?","Benghazi"
"Các nhà phát triển thường làm gì khi tạo ra phần mềm có thể dẫn đến thất bại?","thiếu khả năng tương thích ngược"
"Thuỵ Sĩ có loại chính phủ nào?","một nước cộng hoà giám đốc liên bang"
"Ai là mục tiêu của các công ty thu âm?","Napster"
"Thế hệ iPod Touch nào đã được sản xuất vào tháng 7 năm 2015?","thứ sáu"
"Phong cách yêu sách nào đã được người La Mã ủng hộ như là một liên kết với các vị thần?","yêu sách cá nhân"
"Lực lượng nào là một phần của Rangers?","lực lượng dự trữ"
"Nhóm côn trùng nào được bao gồm trong Monocondylia chủ yếu là do hình dạng bắt buộc của chúng?","Archaeognatha"
"Lưới điện đường phố Richmond được phát triển lần đầu tiên vào năm nào?","1737"
"Làm thế nào các cầu thủ xuất sắc nhất thế giới của FIFA có các thành viên của FC Barcelona giành chiến thắng?","7"
"Cây đàn guitar đặc trưng của Brian May được sản xuất vào năm nào?","1963"
"Khi sự đồng ý của hoàng gia diễn ra ở Anh, chủ quyền xuất hiện ở đâu?","House of Lords"
"bài hát nào của marshall jefferson đã trở thành một hit lớn?","""Move Your Body"""
"Irvin Rock đã viết về cái gì?","nhận thức gián tiếp"
"Tên của thoả thuận giữa Anh và Trung Quốc đã giữ người Anh ra khỏi Tây Tạng là gì?","1906 Công ước Anh-Trung"
"Bài hát nào của Mariah Carey ảnh hưởng đến cô?","Tầm nhìn của tình yêu"
"Có bao nhiêu người đã hoàn thành New York Marathon năm 2006?","37.866"
"Victoria đã không sẵn sàng kết hôn ở tuổi 17?","Albert"
"Thời kỳ nào được gọi là ""thời hoàng kim""?","giai đoạn từ Johann Sebastian Bach đến Beethoven"
"Lãnh đạo Nhân Chứng Giê-hô-va nói gì để cung cấp?","hướng dẫn thiêng liêng"
"Năm nào Nga từ bỏ DST cả năm và quay trở lại Giờ chuẩn?","2014"
"Sân bay bận rộn thứ hai ở Úc là gì?","Sân bay Melbourne"
"Mất bao lâu để một chirigota chuẩn bị trang phục?","cả năm"
"Frédéric đã đi đến nước nào đầu tiên sau khi lên đường đến Tây Âu?","Áo"
"Những phòng khám đáng chú ý có mặt trong bệnh viện Derriford?","Bệnh viện mắt Hoàng gia"
"Tổ chức giáo dục đại học nào tồn tại ở Plymouth vào năm 1880?","Đại học Kỹ thuật Hải quân Hoàng gia"
"Có bao nhiêu người Hồi giáo chuyển đổi sang Cơ đốc giáo theo một cuộc thăm dò năm 2015?","10,2 triệu"
"Armstrong-Jones đã đưa ra danh hiệu gì?","Bá tước Snowdon"
"Toà án đã xác định số phận của Maclean sau khi bắn Nữ hoàng là gì?","không có tội vì lý do điên rồ"
"Trường tư thục nào, với sự khác biệt đáng chú ý là cơ sở giáo dục lâu đời thứ năm ở Hoa Kỳ, được thành lập ở New Haven?","Hopkins School"
"Các hoạt động của chính phủ không liên bang có thể ảnh hưởng đến môi trường sống quan trọng thường tuân theo Đạo luật về các loài có nguy cơ tuyệt chủng như thế nào?","yêu cầu phải có giấy phép liên bang"
"Bạn có thể tìm thấy fanzines được bán ở đâu trong những ngày trận đấu của Everton?","Goodison Park"
"Khi nào Hiệp định về các khía cạnh liên quan đến thương mại của quyền sở hữu trí tuệ được ban hành?","1994"
"Thống đốc Ohio năm 1991 là ai?","Dick Celeste"
"Có bao nhiêu sân phạt được trao khi bóng ở gần vạch cầu so với sân phạt thông thường?","một nửa khoảng cách đến vạch cầu môn"
"Ma Yuan chết vào năm nào?","40 sau Công nguyên"
"Hệ thống IASP lưu ý bao nhiêu loại đau?","5"
"Bao nhiêu tiền đầu tư của JPMorgan sẽ được đào tạo nghề?","12,5 triệu đô la"
"Ngôn ngữ phổ biến thứ hai được nói ở Montana là gì?","Tiếng Tây Ban Nha"
"Những con chim cái có những gì cho phép tinh trùng từ con đực tồn tại lâu sau khi giao hợp?","cơ chế lưu trữ tinh trùng"
"Ai có chung hệ thống đẳng cấp như Ấn Độ giáo?","của szlachta"
"Dân số tăng gấp bốn lần vào năm 1880 chủ yếu là do những gì?","cuộc di dân lớn ở châu Âu"
"Số lượng sinh viên gần đúng ở Đức đang theo học tại một trường đại học công nghệ là bao nhiêu?","290"
"Độ tuổi nào chứa nhiều người nhất từ ​​Southampton?","20 Ném24"
"John được sinh ra khi nào?","24 tháng 12 năm 1166"
"Những dòng xe buýt sử dụng thành phố như một trung tâm?","Greyhound Lines"
"Ai công khai muốn hoà bình với Liên Xô","Chính phủ Đức"
"Ai bị sa thải khỏi vị trí Bí thư thứ nhất bởi Gorbachev?","Rafiq Nishonov"
"Do sông băng tidwater bê trên hoặc dưới mực nước biển?","trên mực nước biển"
"Thư viện RIBA được thành lập khi nào?","1834"
"Ăng-ten kích thước nào sẽ không tốt khi ăng-ten cần định hướng?","nhỏ"
"Nhà Tần ở đâu?","Gansu và Shaanxi"
"Tên của thuốc vi khuẩn tổng hợp đầu tiên là gì?","arsphenamine"
"Côn trùng cơ bắp được gắn vào cái gì?","exoskeletons"
"Trò chơi PS3 nào có thể tích hợp PlayStation Portable để sử dụng làm gương chiếu hậu?","Formula One Championship Edition"
"Cùng với hiện tại, động từ trong tiếng Anh cổ là gì?","quá khứ"
"Quân đội Hoa Kỳ đã đề xuất những gì?","xây dựng một bến tàu sân bay mới trên đảo Guam"
"Ai đã bị xử tử vào ngày 30 tháng 3 năm 1960?","James W. Rodgers"
"Vị trí của khe cắm mở rộng của SE có khả năng làm lộ ra một thứ cao cấp hơn?","điện áp cao"
"Vào năm nào, vị trí đường Suffolk bắt đầu đặt một cơ sở của nhà thờ Đức Bà?","1998"
"Phần nào bộ đếm chương trình có thể được thay đổi bằng tính toán?","ALU"
"Tên của bài báo xuất hiện trên tạp chí TIME vào tháng 4 năm 2009 tuyên bố cuộc khủng hoảng là gì?","Nhanh hơn khi nó bắt đầu, Cuộc khủng hoảng ngân hàng đã kết thúc."""
"Loài côn trùng nào có khả năng đi lại trên mặt nước?","striders nước"
"Có bao nhiêu người sơ tán đến Houston sau cơn bão Katrina?","150"
"Tại nhà tù nào đã thực hiện các vụ hành quyết phi pháp xảy ra theo HRW?","Abu Salim"
"Liệu bulp halogen tăng, giảm hoặc không có ảnh hưởng đến sự bay hơi dây tóc?","giảm"
"Ai đã nói Rupert Murdoch mua American Idol cho FOX?","con gái ông Elisabeth"
"Điều gì đặt ra các tiêu chuẩn theo đó Viện Hoàng gia hoạt động?","Byelaws"
"Những loại máy Normall có tường lửa?","được kết nối vĩnh viễn với Internet"
"Quyền lực nào không được Hiến pháp trao cho Quốc hội?","thiết lập một tôn giáo quốc gia"
"Pháo đài Bismark nằm ở đâu?","Wolfisheim"
"Những loại trường hợp nào có thể được kháng cáo lên Toà án Hiến pháp của Tây Ban Nha?","những trường hợp liên quan đến quyền con người"
"Daptobacter sử dụng kỹ thuật gì để tiêu diệt vi sinh vật khác?","xâm chiếm một tế bào khác và nhân lên bên trong cytosol"
"Đôi khi các danh từ không đếm được trong tiếng Hà Lan có một kết thúc nhỏ để làm cho chúng đề cập đến những gì, giống như một hình nón kem?","một phần"
"Hiệu ứng trên một bản sao nếu một chủ như một hiệu ứng vỏ cam là gì?","không có hiệu ứng xấu"
"Vương quốc Anh tỷ lệ việc làm là 10,2% trong tháng 10 năm 2009, đây là tỷ lệ cao nhất kể từ năm nào?","1983"
"Ai là thị trưởng của thành phố Tirana?","Edi Rama,"
"Thuật ngữ cho vị trí cao nhất trong chính phủ tại Thành phố Vatican là gì?","Bộ trưởng Ngoại giao"
"Trường hợp vật liệu di truyền bổ sung được tìm thấy trong các vi khuẩn gây bệnh?","plasmid"
"Các quan chức muốn thấy điều gì xảy ra giữa hai nước?","mong muốn tăng cường liên kết giữa các lực lượng quân sự của Vương quốc Anh và Myanmar"
"Khi nào Đường sắt Bắc Thái Bình Dương đến Montana từ phía đông?","1882"
"Học sinh nhận được gì khi công việc được gửi lên cho tốt?","thẻ"
"Tại sao Mỹ có quân đội ở Okinawa?","để bảo vệ Nhật Bản."
"Ai đã thành lập một trạm hải quân để cắt giảm buôn bán nô lệ châu Phi trên đảo vào năm 1840?","của Anh"
"Khí hậu chính trị của Houston là gì?","chia"
"Philip đã thua trận Cynoscephalae vào năm nào?","197 TCN"
"Ai đã giúp cải thiện mối quan hệ giữa Ấn Độ và Miến Điện?","Thủ tướng Bêlarut Mikhail Myasnikovich và phu nhân Ludmila"
"Saaremaa nằm ở đâu?","Biển Baltic"
"Khoảng thời gian nào là bữa tiệc thành viên đại chúng bắt đầu?","thế kỷ 19"
"Bell sẽ nói về phần nào trong đầu mẹ?","trán"
"Nguyên nhân của các cơ hội trong số lao động trẻ em cho ngày nay là gì?","nguồn dữ liệu"
"BBC đã làm gì?","đã xin lỗi vì giả mạo cảnh quay"
"Toà án cao nhất của Pháp nằm ở đâu?","Paris"
"Hai điều gì đã trở nên được coi là khác biệt với nhau?","bản sắc giới ngày càng được coi là một hiện tượng khác biệt với xu hướng tính dục"
"Ai đã bắt đầu Fiesta de los Vaqueros?","Leighton Kramer"
"Cha của Schwarzenegger ở thị trấn của họ là gì?","cảnh sát trưởng địa phương"
"Nếu một cậu bé chọn sống trong một ngôi nhà của Oppidan thay vì nhà College, chúng được gọi là gì?","Học giả Oppidan"
"Các trọng tài đặc biệt có khả năng làm gì?","Họ cũng có khả năng phóng ra từ những chiếc nhẫn bất kỳ tuỳ tùng / ổn định của đô vật gót chân, người có thể can thiệp vào trận đấu."
"Điều gì gần đây đã dẫn đến sự hồi sinh trong văn hoá Chamorros và bảo tồn những cách thức cũ của họ?","Chamorros trẻ tìm cách tiếp tục những cách thức cổ xưa của người Chamorro."
"Những loại thập giá thường được tin rằng Chúa Giêsu đã bị đóng đinh trên?","cây thánh giá hai tia truyền thống"
"Khi nào Trung tâm Học tập Sống được công nhận là ""toà nhà sống""?","2010"
"Những loại niềm tin tôn giáo chính trị nào Elizabeth dường như ủng hộ?","quan hệ liên tín ngưỡng"
"Ai từng là bộ trưởng dưới thời Charles II?","Clarendon"
"Ngoài nhiên liệu sinh học, Shell còn tham gia các hoạt động năng lượng tái tạo nào khác?","gió"
"Có bao nhiêu người châu Phi đã được chuyển đến Mỹ trong khoảng thời gian từ 1492 đến 1888?","12 triệu"
"Mặc dù băng thông giảm, định dạng HDTV vẫn phải phân phối như thế nào?","bởi vệ tinh"
"Điều gì cho thấy có một bề mặt bên trong giữa thuỷ tinh và tan chảy?","rào cản tạo mầm"
"Veronal đã được sử dụng để làm gì khi Bayer đưa nó ra thị trường?","hỗ trợ giấc ngủ"
"Trong những khu vực châu Âu, đạo Tin lành vẫn là tôn giáo được thực hành nhiều nhất?","các quốc gia Bắc Âu và Vương quốc Anh"
"Các nhà sinh lý học thần kinh học làm gì?","các tính chất hoá học, dược lý và điện của não"
"Khu rừng nào nằm trên bờ đối diện của River Test từ Southampton?","Khu rừng mới"
"Sự phát triển trong công nghệ nano đang bị phá hoại bởi loại IP nào?","bằng sáng chế"
"Ai tin Serbo-Croatia là một ngôn ngữ có nhiều biến thể?","Enisa Kafadar"
"Descartes đã nghĩ đau là gì?","một sự xáo trộn"
"Khi nào phiên tiếp theo được lên lịch?","1963 từ ngày 12 tháng 5 đến ngày 29 tháng 6"
"Động cơ tĩnh điện như hai của là gì?","động cơ dựa trên cuộn dây thông thường"
"Tỷ lệ sinh trong các gia đình Do Thái không chính thống là gì ??","1,9 trẻ"
"Điều gì định nghĩa một loại cổng USB mới, được gọi là cổng sạc?","Bản sửa đổi thông số sạc pin USB 1.1"
"Arsenal đã có bao nhiêu chiến thắng để biến đội bóng thành công nhất trong lịch sử FA Cup?","12"
"Họ đã tuyên bố gì về báo cáo của BBC?","giả"
